verb	label	sentence	start_char	end_char
remember	STATIVE	the place I barely remember ever having lived in anymore.)	19	26
have	STATIVE	If you do have something better to do, though, by all means do it .	10	13
know	STATIVE	I should know.	9	13
need	STATIVE	You need to try to have a life outside your computer.	4	7
explaining	DYNAMIC	The one that really stuck in my mind was explaining transitions in the panels of Watchmen .	41	50
liked	STATIVE	"I also liked ""Teaching the Overdetermined Image."""	7	11
seems	STATIVE	Also, The Day in Actual Communist and Real Nazi History seems as relevant today as ever.	56	60
appeared	DYNAMIC	What happened to your post that appeared in my RSS reader yesterday?	32	39
feel	STATIVE	I feel your British readers would appreciate that.	2	5
reminds	DYNAMIC	The Internet occasionally reminds me of how different life is because of it.	26	32
watching	STATIVE	In this case, the something in question was watching the wonderfully named Angel Pagan hit an inside-the-park home run and initiate a triple play in the same game.	44	51
is	STATIVE	The fact that at some point in the future I can know who I rode in an elevator with on 28 December 2005 is less weird because I chose to write about riding in an elevator with Grimace .	104	105
is	STATIVE	That I can access detailed information about events I have no right remembering in detail is another matter entirely.	90	91
forgotten	DYNAMIC	I'd completely forgotten about him.	15	23
is	STATIVE	What's really bothersome, though, is when you only remember things from your distant past.	34	35
was	STATIVE	A guess, but perhaps your grandfather's life at 22 was more interesting than the ensuing 70 yrs.	51	53
burned	STATIVE	But burned out toward the end.	4	9
is	STATIVE	Apparently, he is a player's representative now.	15	16
given	DYNAMIC	Having given up on watching the actual sport, mention of baseball now only sparks memories of The Old Man and the Sea and the old time baseball writers.	7	11
is	STATIVE	nota bene: An overdue library book is a crime against Humanities.	35	36
become	DYNAMIC	Now, many more moderate Muslims have become radicalized, world-wide, willing to kill innocent civilians in order to achieve their purposes.	37	42
expanded	DYNAMIC	And the serious targets have expanded to include civilians in Russia, India, Maylasia, the Philippines, Spain, and elsewhere, as well as Israel and its sole supporter, the United States.	29	36
reported	DYNAMIC	The terrorists could strike any time they choose, through any of the numerous loopholes so well reported in our media.	96	103
keep	STATIVE	So the Bush administration can keep claiming that we are safer now, under their policies.	31	34
made	DYNAMIC	"By trying to ""stamp out"" terrorism by killing terrorists, Bush and Israel have made things infinitely worse for us: more dangerous, not safer."	79	82
come	DYNAMIC	And proof that Bush has failed may come at any moment, explosively, with one big successful attack here in the USA.	35	38
is	STATIVE	"TERRORISM is ""the systematic use of violence to create a general climate of fear in a population and thereby to bring about a particular political objective."""	10	11
is	STATIVE	We believe that any terrorist act is a crime against humanity and against the will of God, because it deliberately intends to injure and kill innocent people.	34	35
is	STATIVE	Our purpose here is to NEUTRALIZE TERRORISM by removing the motivation for it.	17	18
end	DYNAMIC	So you end up fighting the entire population.	7	9
end	DYNAMIC	In all of these cases above, if the radical Muslims would cease their attacks, all terrorism on both sides of every dispute would quickly end.	138	141
are	STATIVE	The moral and religious theories which support terrorism are quite faulty and erroneous.	57	59
need	STATIVE	They need to be identified and attacked.	5	8
is	STATIVE	If the terrorist loses faith in the righteousness of his acts, he is less likely to perform them.	66	67
find	DYNAMIC	In every case of terrorism, we will find some kind of legitimate underlying grievance.	36	39
recognizing	STATIVE	It is simply recognizing the realities of human motivation, right or wrong.	13	23
found	DYNAMIC	A big picture of our entire Anti-Terrorism strategy can be found at our website =>	59	63
returned	DYNAMIC	I recently returned to the US from Australia.	11	18
took	DYNAMIC	The 14-hour flight took me from Monday morning in Sydney to Monday morning, again, in L.A.	19	22
messed	DYNAMIC	Crossing the date line messed up my sense of time enough without the added bonus of thinking I should be heading to bed just as the sun began to climb into the California sky.	23	28
be	STATIVE	You may be familiar with the concept: Jet lag.	8	9
work	DYNAMIC	Normally, two systems -- the homeostatic system and the circadian system -- work together to produce a 24-hour sleep cycle.	76	79
spent	DYNAMIC	During the day, the homeostatic system slowly accumulates a 'sleep drive,' a desire to sleep that increases as a function of time spent awake.	130	134
keeps	STATIVE	The circadian system generates an alerting signal in opposition to this sleep drive, which, during the day, keeps a person from feeling increasingly sleepy.	108	112
hit	STATIVE	An hour or two before bedtime, this signal subsides, and s/he realizes it's time to hit the pillow.	84	86
feeling	STATIVE	The sleep drive dissipates as a person sleeps and by morning (assuming a full night's rest and possibly some coffee), s/he will be feeling alert and ready to go again.	131	137
is	STATIVE	Robert Sack wrote a delightful paper [PDF] on jet lag, by the way, which is where I'm getting much of my information.	73	74
got	STATIVE	So we've got a nice cycle of sleep.	9	11
is	STATIVE	Jet lag is what happens when the homeostatic and circadian processes are misaligned.	8	9
want	STATIVE	But I don't want to be sleepy!	12	15
lists	STATIVE	Robert Sack lists three primary approaches:	12	16
shown	DYNAMIC	Studies have shown that without light cues, totally blind people tend to have free-running circadian rhythms with an average period of 24.5 hours, instead of the usual 24.	13	17
has	STATIVE	Brighter light has more of an effect (such as the sun, at 3000 to 10,000 lux), though lower intensities (e.g., 100-550 lux) can produce changes.	15	17
thought	STATIVE	"Melatonin is secreted by the pineal gland at night; secretion is suppressed by light exposure, and as such, the hormone can be thought of as a ""darkness signal."""	127	133
administered	DYNAMIC	If doses of melatonin are combined with light exposure, the results are what you might expect: synergistic if both are administered to produce a time shift in the same direction (both earlier or both later); antagonistic otherwise.	119	130
is	STATIVE	The problem with this is that your sleep-wake schedule won't match up with that of the people around you, and if you need to be awake for breakfast at 7am or for a meeting in the afternoon, your sleep schedule may interfere.	22	23
have	STATIVE	Lastly, we have sleep medicines.	11	14
is	STATIVE	Of course, the only solution that will always work is time.	51	52
are	STATIVE	The Fuller, Lu, & Saper paper [PDF], published in Science , discusses the mechanism, though a more recent paper argues that the Fuller et al results are inconclusive .	149	151
makes	DYNAMIC	The gentle wind makes them flutter.	16	20
spent	DYNAMIC	I spent the past weekend there.	2	6
like	STATIVE	I like learning new things, so I signed up.	2	5
say	DYNAMIC	"He began by telling us, ""Do not take any of what I say on faith."	51	53
is	STATIVE	"Take it through analysis, if there is some benefit in it for you."""	35	36
have	STATIVE	You believe the other medicine may have just as much value, but in other situations, not this one.	35	38
discussed	DYNAMIC	We discussed the foundations: the Three Turnings of the Wheel of Dharma; the four noble truths; karma; defilements; the six perfections.	3	11
asked	DYNAMIC	"So, a fellow student asked, ""Giving one's life for another being is the ultimate gift?"""	21	26
shook	DYNAMIC	Khenpo Kalsang, he smiled, and shook his head.	31	35
said	DYNAMIC	Only if you feel no regret, he said.	31	35
feel	STATIVE	If you feel regret, it destroys the merit.	7	10
cause	DYNAMIC	Until then, preserve your own life, and do not give away anything that would cause you regret.	77	81
struck	DYNAMIC	This struck a chord.	5	10
been	STATIVE	Ever since the 1920s, their science has been about observation of behavior, questionnaires, recordings of electrical brain activity.	40	43
intend	STATIVE	I intend to discuss it in more depth later, so stay tuned.	2	7
gathered	DYNAMIC	In the afternoon, a group of us gathered outside for a meditation session with Ani Kunga.	32	39
were	STATIVE	Compassion and anger were the session's topics.	21	24
explained	DYNAMIC	Ani Kunga explained several off-session and one on-session technique for dealing with negative emotions (anger, hate, irritation, stress, jealousy, and so on).	10	18
making	STATIVE	Another of the day's activities was making prayer flags.	36	41
do	DYNAMIC	But if no one shares their prayers, it will certainly do no good.	54	55
done	STATIVE	This weekend reminded me that I'm not done learning.	38	41
used	DYNAMIC	"In the paper, ""self-control"" is used to mean a sense of willpower."	32	35
is	STATIVE	An important premise to note here is the idea that the probability of choosing a goal or making a resolution increases if a person thinks that goal can be attained.	34	35
discuss	STATIVE	Mukhopadhyay & Venkatarmani also discuss self-efficacy: belief in one's capabilities, the perceived ability to carry out a desired action.	33	39
read	DYNAMIC	In the first study, 85 participants (all college students) each read one of four passages presenting lay theories of self-control.	64	67
adding	DYNAMIC	The third study moved on to examine goal achievement, adding a measure to look at self-efficacy.	54	59
had	STATIVE	The study had two sessions, in November then February.	10	12
have	DYNAMIC	Self-efficacy did not have a significant effect on goal-setting.	22	25
was	STATIVE	As far as success goes, only the interaction between lay theory and self-efficacy was significant.	82	84
been	STATIVE	This proposal has been in the works for nearly two years, and at long last, folks are voting to approve it.	18	21
get	DYNAMIC	After all, I could get half a unit a semester for up to four semesters -- a typical class is worth one unit, and a typical physical education course of any level is worth half a unit, with a maximum of two physical education units counting toward graduation requirements.	19	21
agrees	STATIVE	My friend over at Carolyn Blogs agrees: from the above standpoint, sure, it seems fair to give credit to students .	32	38
get	DYNAMIC	If you get credit for introductory P.E.	7	9
get	DYNAMIC	classes, you should get credit for varsity athletics.	20	22
present	STATIVE	On top of everything, we must remember that varsity athletics present a considerable time commitment.	62	68
gone	STATIVE	Varsity athletes regularly travel throughout the northeastern to participate in meets, games and tournaments, often gone from campus for an entire weekend at a time.	116	119
do	DYNAMIC	If I cared more about other activities, I'd do those instead.	44	45
backed	STATIVE	And she's backed up by our school's system of awarding units instead of credit hours :	10	15
made	DYNAMIC	Sacrifices must be made, sure: Dance party on Friday night, or overnight travel to a competition?	19	23
continues	STATIVE	The article continues:	12	21
make	STATIVE	Adding the option of a varsity unit to the list doesn't make much of a difference.	56	59
add	DYNAMIC	Students who aren't varsity athletes could add an easy P.E.	43	45
continue	STATIVE	Students who can balance their work and their sport will continue to do so.	57	64
are	STATIVE	Academics are officially what college is about.	10	12
are	STATIVE	Academics are what get graded.	10	12
are	STATIVE	Students' GPAs will, in part, determine what they are able to do with their lives.	50	52
are	STATIVE	But academics are only one particular kind of knowledge.	14	16
think	STATIVE	And that, I think, is the best reason for awarding credit for varsity athletics.	12	17
lie	STATIVE	America's Rust Belt is a swath of cities and towns that boomed during the Industrial Era and now lie -- well, rusting -- as empty remainders of glory days past.	97	99
read	DYNAMIC	I'd read a New York Times article about some forward-thinking artist-types who bought a house in Detroit for $1,900 .	4	7
pay	DYNAMIC	Some of us (and lots of New Yorkers) pay that much in rent every month!	37	39
went	DYNAMIC	In fact, the article went on, soon a nearby house went on the market for $100.	21	24
were	STATIVE	The possibilities of this were fascinating.	26	29
had	STATIVE	I had visions of hipsters from coast to coast converging in Detroit, building a new city on rock&roll.	2	4
saw	DYNAMIC	I saw community gardens, art parks, a grassroots transformation of a city.	2	4
take	DYNAMIC	We could take that oil-stained soil and those rusted factories, and create something new and beautiful.	9	12
dove	DYNAMIC	We picked two neighborhoods to cruise, and dove in.	43	46
hit	DYNAMIC	But once we entered Detroit, the truth hit fast: this is a modern American ghost town.	39	41
felt	STATIVE	In fact, I've never felt so out of place in all my life .	20	23
live	STATIVE	They live in deserted neighborhoods, in houses with collapsed front steps and missing windows.	5	8
stuck	DYNAMIC	And we, driving through slowly and reading house numbers in a late-model Honda, stuck out like a couple of thumbs.	80	84
went	DYNAMIC	So we sped up, and went straight to the houses.	19	22
stripped	DYNAMIC	"The New York Times correspondent wrote that his friend Mitch's $1,900 home ""had already been stripped of its appliances and wiring ..."	93	100
needed	STATIVE	"It ""needed some work, a hole patched, some windows replaced."""	3	9
saw	DYNAMIC	On one corner, we saw a giant banner hung across a charred front porch.	18	20
come	DYNAMIC	Ultimately, I do believe that change will come to Detroit.	42	45
be	STATIVE	There will be a green movement here ; in fact it's already being cultivated by forward-thinking groups and intrepid locals .	11	12
be	DYNAMIC	One day, this place will be reborn.	25	26
take	STATIVE	Anyone who takes this plunge is risking their life every day, betting on a future that may take a long time to arrive.	91	94
come	DYNAMIC	May your every dream come true, sir, and your book sell fabulously.	21	24
need	STATIVE	I need that	2	5
called	STATIVE	"Please track down and watch a movie called ""Detroit: A City to Yourself"", by Nicole MacDonald."	36	41
focused	DYNAMIC	Most poignantly, it talks about Hurricane Katrina, which focused attention on rebuilding another city with this level of devastation, and how without a single catastrophic event to blame for it, Detroit's decay has gone unsympathetically ignored.	57	63
are	STATIVE	There are industrial spaces being turned into low-rent artist lofts and business incubators.	6	8
refuse	STATIVE	There are neighborhoods that refuse to cave.	29	34
taken	DYNAMIC	There's a whole street being taken over by artists, Farnsworth between Moran and McDougall.	29	33
have	STATIVE	Think about that for a moment, hoes and shovels don't have enough pawn value to be worth carrying out.	54	57
using	DYNAMIC	Whoever took that stuff is probably using it in their own garden.	36	40
refuse	STATIVE	But there are bright spots, and behind every one of them is a person, or a bunch of people, who refuse to give up.	96	101
committed	STATIVE	Seems there's a pretty solid group of Detroit residents who are truly committed to restoring the city, and that's beautiful to see.	70	78
need	STATIVE	Love the fact that people are stealing garden implements (though it's still sad that they need to).	90	93
going	DYNAMIC	Driving a Honda in Detroit right now probably isn't really going to get you welcomed with open arms.	59	63
were	STATIVE	Most of the funny looks you got were less about your color than about your ride.	32	35
be	STATIVE	You think I'm kidding, but I couldn't be more serious -- that Honda is a visceral reminder for people of how the American consumer has left Detroit in the dust.	38	39
going	STATIVE	Its going to take some pioneering individuals to start creating those pockets of innovation, creativity, and vision.	4	8
going	DYNAMIC	But its not going to happen with the investment of $100 into a single house.	12	16
have	STATIVE	For all that is wrong with Detroit -- and that's nearly everything -- you'd be astonished by the pride that Detroiters have for their city.	119	122
abandoned	STATIVE	They lack the means to build her back to her former glory, but she won't be abandoned.	76	85
called	STATIVE	No, even before that -- The Dollmaker has often been called 'America's least pretentious masterpiece'.	53	58
doing	DYNAMIC	I love what you are doing.	20	25
left	STATIVE	Is this the monument left behind for the world to witness, by Corporatism, Capitalism?	21	24
filled	STATIVE	Do we still have fertile backyard gardens, filled with the composting of the age?	43	48
kidding	STATIVE	You gotta be kidding me!	13	19
have	STATIVE	They have the unmidas touch.	5	8
has	STATIVE	Every decaying city in America has D's firmly in control, and has forever.	31	33
kidding	DYNAMIC	Nope, I wasn't kidding.	15	22
approve	STATIVE	Lumpy, I'm not a Democrat and I don't much approve of the Democratic Party.	43	49
say	DYNAMIC	"That's where the green movement comes in, and when I say ""green"" I'm talking plants not politics."	53	55
disappointed	DYNAMIC	I agree -- Democrats, like country music, have disappointed me too many times in the past for me to keep on listening.	47	58
want	STATIVE	You want to yell at which insurance company fucked up, or change a bedpan, so to speak?	4	7
left	DYNAMIC	Just ask the Palestinians who left after the first war to cry over the past.	30	33
made	DYNAMIC	*Or even Friend Salmon, who still haunts my dreams and tells me not to let us blow each other's asses off the earth until we clean up the mess we have made.	151	155
was	STATIVE	*That was for Lumpy.	6	8
has	STATIVE	You told me about this, but it has to be seen to be believed (not that I didn't believe you!).	31	33
find	STATIVE	I find this topic fascinating.	2	5
born	STATIVE	I was born in a suburb of Detroit and most of family still lives there.	6	9
going	DYNAMIC	I will be going back to visit in June.	10	14
plan	STATIVE	I plan to take a (Daytime) tour of these decaying areas especially the old factories.	2	5
have	STATIVE	I have the urban explorer fascination.	2	5
shocked	STATIVE	I, too checked out a few listings for under $1,000 and was absolutely shocked at the property taxes.	70	76
comes	DYNAMIC	A $1,000 house, which could be fixed up into maybe a $30-40,000 house comes with a tax bill of $4-6K per year!	70	74
included	DYNAMIC	/ // License is granted if and only if this entire // copyright notice is included.	74	82
been	STATIVE	"There may very well have been a gasp, and some uncomfortable ""Okay, that's enough now"" chuckles at the end, but the guffaws at the top of the clip are WITH her, not AT her."	25	28
has	STATIVE	I don't think the audience is laughing at Coons; the laughter has an incredulous, oh-my-god sound to it.	62	64
looks	DYNAMIC	When she hears the reaction, she looks out at the audience with a big, proud grin.	33	37
shows	DYNAMIC	So although this shows what an extremist nut O'Donnell is, it's not really a gaffe; it's standard stuff right out of their playbook.	17	21
looking	DYNAMIC	"Well, if one is looking for the phrase, ""Separation of Church and State,"" yeah, that's not in there, so TADA!"	16	22
wins	DYNAMIC	Looks at me, I wins a big arguments and I poops my pants.	15	18
make	DYNAMIC	I love when ignorant fucks like O'Donnell and her little orcling hordes make huge category mistakes like this.	72	75
were	STATIVE	if that were the case.	8	11
have	STATIVE	Yeah, Pea, you have a point there, but still: The laughter doesn't sound incredulous to me, it sounds appreciative and snarky.	15	18
see	DYNAMIC	I don't see a crowd like that laughing out loud at such a pitiful little meme, it's not even worth a laugh-out-loud guffaw.	8	10
had	STATIVE	I know if I had the opportunity to attend a Sarah Palin rally, I'd be overjoyed to hear some incredible stupid falling out of her mouth.	12	14
be	STATIVE	which would be, uh, ANY Sarah Palin rally.	12	14
was	STATIVE	the debate was at a LAW SCHOOL.	11	13
respond	DYNAMIC	"O'Donnell didn't respond to reporters who asked her to clarify her views after the debate."""	17	23
says	DYNAMIC	"Anyone who says ""Evolution is only a THEORY...it's not a fact"" is so stupid; so utterly fucking brainless, uneducated, ignorant, clueless and unread they should immediately be sterilized on the slim chance that there's a genetic component to their imbecility."	11	14
expected	STATIVE	Anyone who stubbornly knows so little about science cannot possibly be expected to develop the analytical skills necessary to interpret Con Law.	71	78
illustrates	STATIVE	I thinks this illustrates their biblical view of the Constitution, and by that I mean they regard it the same way as they regard the Holy Bible.	14	24
know	DYNAMIC	Oh, and like the Holy Bible, that we mere mortals are not supposed to question or interpret, they'll let us know what it really means and that will often conflict with what it actually says.	108	111
makes	STATIVE	They try to exert some sort of control over it's meaning by elevating it to a level that makes it untouchable.	89	93
designed	STATIVE	To them it's not a living document that was designed to change with the nation, but essentially carved in stone like the Ten Commandments.	44	51
come	DYNAMIC	"I've recently come to the conclusion that the answer is ""nowhere""."	14	17
see	STATIVE	they see no problem with racism, sexism and fascism.	5	7
understand	STATIVE	"they don't understand that ""freedom of speech"" doesn't mean freedom from consequences."	11	20
confuse	STATIVE	they confuse losing an election with tyranny.	5	11
was	STATIVE	The debate was at Widener Law School.	11	13
were	DYNAMIC	I don't think they were laughing at him.	19	22
were	DYNAMIC	If they were, they'd be reacting after his comment (and probably booing and calling him a liar) rather than reacting after her comment.	8	12
hope	STATIVE	I hope you're well.	2	5
be	STATIVE	While it can be personally satisfying to present all your little ducks in a row, they will never stop erroneously knocking the damn ducks out of line.	13	14
were	STATIVE	Nah, I'm convinced that the audible gasps and stifled chuckles were from her attempt to bluff her way through an exchange regarding the Constitution in a room full of lawyers.	63	66
do	STATIVE	Palin knows her place, as do they all.	26	27
running	DYNAMIC	O'Donnell's running on personality alone, nothing more, nothing less.	12	18
was	STATIVE	However, she clearly thinks she that she has scored a huge win and that the audience was on her side.	85	87
was	STATIVE	"Her question was the equivalent of asking ""Where're the pictures?"""	13	15
staring	DYNAMIC	when staring at the document, especially in that setting.	5	11
did	DYNAMIC	She did it on purpose, not to further the discussion, but to establish that, yes, she is a dependable dumbass.	4	6
have	STATIVE	Lexaburn, I have to disagree with your assessment that this is all a game and that she's not that dumb.	12	15
intend	STATIVE	Being a perpetual campaigner can only get you so far, and if they don't intend to win after getting the nomination, then that con game is limited.	72	77
saying	DYNAMIC	I'm not saying she knows a damned thing about the Constitution.	8	13
limited	STATIVE	"The ""shelf life"" of both women is only limited to the fraction with which they uphold a standard."	39	45
took	DYNAMIC	Palin took standards out of the equation when she quit her job.	6	9
run	STATIVE	Were she to actually run, it would be for vanity's sake.	21	24
did	DYNAMIC	Well, Palin did anyway.	12	14
attribute	STATIVE	I attribute part of my assessment of O'Donnell to info I've gleaned from a good friend of mine that knew her on the media circuit at the start of the decade.	2	10
saying	DYNAMIC	This friend tells me that Christine doesn't believe half provocative and/or boneheaded things she's saying.	100	106
described	STATIVE	O'Donnell is described as a normal conservative Republican woman by my friend.	13	21
leads	DYNAMIC	Some of the innuendo surrounding her leads me to this conclusion, as well.	37	41
being	STATIVE	You know what, I'm being too much of a stuffy doctor.	19	23
making	DYNAMIC	Anyway, that smile she gives after asking about the 1st Amendment may very well be her being in on the joke she's making of herself.	114	119
thinking	STATIVE	Do not try to make sense out of anything of this if you're not thinking like a...celebrity of whatever quality, let's say.	63	70
continues	STATIVE	Next, ask yourself why she continues to be invited to these public forums.	27	35
seen	DYNAMIC	In all my cable news watching, I've seen far more dim characters than O'Donnell with regular gigs, so it's not the fact that she's dumb that gets her on television.	36	39
campaigning	DYNAMIC	She's not campaigning to win anything, I'm telling you, BC.	10	20
was	STATIVE	"I don't believe that was because she beat the ""establishment"" candidate."	21	23
thinking	STATIVE	I'm thinking she's aiming to be on FNC on a regular basis.	4	11
comes	DYNAMIC	This all comes from my observing her debate performances, as well as her more recent TV appearances.	9	13
runs	DYNAMIC	Just look at the clips Bill Maher runs of her blithering, insistent certainty.	34	37
get	STATIVE	She pisses off EVERYONE, all the time, and never once = not a single time ever - stops long enough to even CONSIDER that maybe she's the one who doesn't get it.	153	155
get	STATIVE	It's THEY who don't get it.	20	22
does	STATIVE	She does because she took a week long course at Oxford University!	4	7
