verb	label	sentence	start_char	end_char
caused	DYNAMIC	the year before Bella went to AL Standback Middle school, CWS â€™s â€œrivalâ€ wich caused even more pressure on her.	78	83
going	DYNAMIC	Bella wasnâ€™t going to CWS alone though, a few people were leaving Standback, no particular reason for it.	13	17
came	STATIVE	This an idea i came up with for a story!	15	18
did	DYNAMIC	Hardly a place for the likes of me, but nobody ever did a thing about it.	52	54
invited	DYNAMIC	So when I invited her over to play a game with me, nobody suspected a thing.	10	16
recall	STATIVE	I recall how she cried when I chopped it all off with messy, rough snips.	2	7
play	DYNAMIC	First, you must play along.	16	19
closed	DYNAMIC	His fingers closed around his own throat as he struggled in the water.	12	17
bulged	DYNAMIC	His eyes bulged and his legs jerked around.	9	14
calls	DYNAMIC	â€œAir-ee-el!â€ Sofia calls.	19	24
missed	STATIVE	â€œI missed you.â€ He says as he kisses my lips.	3	8
calls	DYNAMIC	â€œCome on you two lovebirds!â€ Sofia calls.	35	40
cause	STATIVE	â€œThatâ€™s â€˜cause if I left it up to you, weâ€™d never part and weâ€™d get nothing done!â€ I laugh, wraping my arm around his waist as I start after Sofia and Eaden.	8	13
felt	STATIVE	I felt woozy and blacked out â€“ again.	2	5
thought	STATIVE	The memories I had of him were all memories of when we were going out, when I thought I was in love.	78	84
caused	STATIVE	Every memory I had only caused me pain to think about.	24	29
went	STATIVE	I went a good three seconds before hyperventilating and putting it back on my finger.	2	5
needed	DYNAMIC	I needed to just forget him, because I was dying inside.	2	7
needed	DYNAMIC	I needed him to breath.	2	7
felt	STATIVE	Without him, I felt so wrong!Every memory that once made me smile now caused the pain in my chest.	15	18
work	STATIVE	Friendships that annoy the hell out of you but you know will work out.	61	64
working	STATIVE	Learning from friendships that really.... arenâ€™t working out.	49	55
looks	STATIVE	A whole page of cursive writing that looks so cool!!	37	41
identify	DYNAMIC	Blasting the rock and roll so loud that everyone within a ten yard radius can hear it and identify the song.	90	97
makes	DYNAMIC	ANYTHING that makes you LAUGH OUT LOUD .	14	18
finished	DYNAMIC	I finally finished the page!	10	17
veered	STATIVE	The path veered to the right.	9	14
veered	DYNAMIC	I nearly veered off it.	9	14
was	DYNAMIC	I was daydreaming again.	2	4
blowing	STATIVE	The wind was blowing hard.	13	19
regretted	DYNAMIC	I suddenly regretted not getting a haircut when my mom told me to.	11	19
felt	DYNAMIC	He felt the windows â€“ extremely thick plastic-type material to keep out the vacuum.	3	6
going	DYNAMIC	Calvin started screaming and crying, and Abbey was going into shock.	51	55
settled	DYNAMIC	Abbeyâ€™s breath calmed as the cone molded to her mouth, and she settled down to a comfortable peace.	63	69
thought	DYNAMIC	Seth thought he could use some of that right about now.	5	11
faded	STATIVE	I still remember finding her, how faded she was.	34	38
faded	DYNAMIC	How she faded into nothingness.	8	12
lit	DYNAMIC	And the way the smile lit up your whole face.	22	24
miss	STATIVE	I miss you so much.	2	5
hold	STATIVE	I hold in these feelings.	2	5
held	STATIVE	The smile shrank to a pout as she discovered the archway held no shelter from the torrent.	57	60
thought	STATIVE	I thought of other things, of home.	2	8
played	DYNAMIC	I played a song in my head, one that I'd heard on the radio.	2	7
looked	STATIVE	It probably looked a little funny, me lying there humming, him trying to talk to me.	12	17
prevented	DYNAMIC	He said this with a sort of astonishment, as if by me singing, I'd prevented something previously... unpreventable.	67	75
had	STATIVE	I had no safe refuge.	2	4
had	STATIVE	I still had a killer headache.	8	10
thought	STATIVE	I thought something bad had happened.	2	8
understood	DYNAMIC	He wouldn't have understood until later.	17	26
veered	DYNAMIC	At the top of the hill, I veered south.	26	31
had	STATIVE	I had never been to this part before, and so I had no clue what awaited me.	2	4
find	DYNAMIC	I would soon find out.	13	16
headed	STATIVE	Shivering, and not from the cold, I walked my bike through the tall grasses, not quite sure where I was headed.	104	110
sleep	DYNAMIC	"Come on, you can sleep in there.	Come on, you can sleep in there.""?"	17	21
do	STATIVE	You're the only one who thinks like I do, who understands this at all.	38	40
ignoring	DYNAMIC	Theo, ignoring his roommate, pulled me over to the beds against the side of the wall.	6	13
making	DYNAMIC	I scratched the pillowcase, making a soft sound to help distract myself.	28	33
rolled	DYNAMIC	I rolled back over, trying to get back to my dream.	2	7
stay	STATIVE	"So""Â¦ you can stay here I guess.""?"	13	16
followed	STATIVE	I heard him shuffle out of the room, followed by his roommate.	37	44
had	STATIVE	I had no idea what he was even doing.	2	4
left	DYNAMIC	Gathering up his things, he left the room.	28	31
hurt	STATIVE	"It didn't hurt""Â¦ which is weird, but there's nothing to be sorry about."	10	15
do	DYNAMIC	"He can't do that to you again.	He can't do that to you again.""?"	9	10
going	DYNAMIC	"He's going to get away with everything.	I sighed. He's going to get away with everything. If he ""Ëœneeds' to do something, he's going to do it, as much as I don't want him to. He already told me: I have no control.â€"	5	9
going	DYNAMIC	"If he ""Ëœneeds' to do something, he's going to do it, as much as I don't want him to."	37	41
was	DYNAMIC	Yet he was smiling.	7	9
whispered	DYNAMIC	I whispered to him and his smiled widened.	2	10
going	DYNAMIC	"Sooner or later, he's going to get tired of rescuing me from Robert and then ""Â¦ well, I just don't know."	22	26
had	STATIVE	Having an amazing time was no problem, considering the fact that Jared and I had a lot in common.	77	79
had	STATIVE	I read and commented it, then checked my Myspace and had a ton of new friend requests from people in school.	53	55
didnt	STATIVE	I didnt think it was a big deal, so I ignored it, leaving him where he was on mine.	2	6
had	STATIVE	He later messaged me asking if I had fun and all that day.	33	35
thought	STATIVE	I answered him, laughing in delight, when he suddenly replied â€œHey, why arent i first on your top?â€ Well, i did have other friends I thought.	133	140
invited	STATIVE	I denied the request, because i was already invited by other people.	44	50
had	STATIVE	Free from authority, free from pestering humans who had too many questions and too much hate, and most of all free from Gianna.	52	54
insisted	STATIVE	The wind insisted on punching me in the face, so I punched it back, screaming: â€œHoooo yeeeaaaaaahh!â€ I leaped in the air and landed on my feet, grinning.	9	16
hold	DYNAMIC	I couldnâ€™t hold it in!	11	14
hang	DYNAMIC	We could hang out any other day, couldnt we?	9	12
understood	DYNAMIC	He seemed as if he understood, and told me to have fun.	19	29
got	DYNAMIC	After I got to school, I met Jared, er, he met me at the door.	8	10
named	STATIVE	After school, me and the group I was with lounged at the the local cafe(which was conviently named â€œMarz Cafeâ€).	93	97
had	STATIVE	We talked and laughed and had TONS of fun, especially with Jueli.	26	28
did	DYNAMIC	She made me laugh, and so did everyone else.	26	28
felt	STATIVE	I felt bad for leaving Jared though.	2	5
have	DYNAMIC	The extent of love can never be reached... so of course we have to reach it!	59	62
covered	STATIVE	Oops, now my clothes are covered in dog hair.	25	31
saves	DYNAMIC	Wikipedia saves my life everyday!	10	14
sat	STATIVE	Melody sat up high in a tree, grieving again for the loss of her trainer, Jayden.	7	9
named	STATIVE	He had been attacked by people that were looking for someone named Owen.	61	65
did	STATIVE	Melody had watched it all happen, she ran after the ones that killed her, but they had talents that she did not.	104	106
gone	STATIVE	They were gone before she could catch them, and she ran back to Jayden.	10	13
sat	STATIVE	So there she sat, her tears falling through the branches, splashing silently into the earth beneath the tree, sobbing for the loss of her trainer.	13	16
had	DYNAMIC	He had beenteaching her tai kwon do, so she could learn more self defense.	3	5
lingers	STATIVE	â€œSo, youâ€™ll pray to Saint Anthony for me?â€ she asks for the billionth time, as your hand lingers over the door knob.	89	95
find	DYNAMIC	You have been idling in her foyer for the past three minutes while you find excuses to not say goodbye to one another.	71	74
missing	STATIVE	Despite an extensive search of her bedroom, during which she uncovers her middle school yearbook (you laugh at her frizzy hair and braces; she snatches the book back and snaps it shut), a lacy black bra (which she quickly hides away in a drawer, cheeks furiously pink), and twenty dollars (to her delight), her diamond earring is still missing.	336	343
thought	DYNAMIC	she thought to herself, wiping the tears from her face, momentarily distracting from her mourning.	4	10
looked	STATIVE	She noticed a boy, he looked about fifteen, but he was short.	22	27
armed	STATIVE	She could tell they were armed by the way their clothes moved over places like their ankles or their chests.	25	29
looked	DYNAMIC	He looked over at her, surprised.	3	8
keep	DYNAMIC	The boy exclaimed, amazed that she could keep up.	41	44
following	DYNAMIC	"I ran for it and they've been following me since then,""?"	30	38
gone	DYNAMIC	The two men came to a halt, not knowing where the youths had gone.	61	65
appear	DYNAMIC	Walking would appear as running, when traveling in the mirror realm, that is, if anyone in the real world was able to see them.	14	19
did	DYNAMIC	Melody stopped, as did the boy.	19	21
looked	DYNAMIC	She looked over at the two thugs, moving in slow motion.	4	9
looked	DYNAMIC	They looked around, and disappeared.	5	10
gone	STATIVE	She walked over to where they had been standing, to make sure that they were really gone.	84	88
called	DYNAMIC	She called over to Owen who was still standing where they had stopped.	4	9
did	DYNAMIC	Melody did the same and walked over to Owen, now at regular speed.	7	9
looked	STATIVE	He looked fine.	3	8
shook	STATIVE	he replied, nonetheless a little shook up.	33	37
looked	DYNAMIC	He took a deep breath and looked at her.	26	31
had	DYNAMIC	â€œWent on the loose; had with him about five hundred dollars belonging to the firm;heâ€™s with Isaacs & Sons now, shoe people on Sixth Avenue.	20	22
committed	DYNAMIC	They tried to withdraw the charge, but heâ€™d been committed.	49	58
decided	STATIVE	With one eye closed, and the other keenly regarding the inkstand, Mr. Thorndike decided to pay the price; and with the facility of long practice dismissed the Correggio, and snapped his mind back to the present.	80	86
left	DYNAMIC	"What he hasdeveloped into, SINCE he left usâ€”â€ he shrugged his shoulders.	â€œSpear had a letter from us when he left, didnâ€™t he?â€ he asked. What he hasdeveloped into, SINCE he left usâ€”â€ he shrugged his shoulders. The secretary withdrew the letter, and slipped another in its place."	36	39
run	DYNAMIC	Says it will run to about five thousand dollars a mile.â€	13	15
makes	DYNAMIC	â€œNo!â€ protested the great man firmly, â€œblue flint makes a country place look likea cemetery.	50	54
looks	STATIVE	Mine looks too much like a cemetery now.	5	9
planted	DYNAMIC	â€œTell him,â€ commanded Thorndike, â€œI want a wood road, suitable to a farm; and tolet the trees grow where God planted them.â€	109	115
occupied	STATIVE	But his busy mind was not too occupied to return the salutes of the traffic policemen who cleared the way for him.	30	37
remembered	DYNAMIC	He remembered the young man now, and favorably.	3	12
leading	DYNAMIC	It was these same impulses, leading so invariably to success, that made his enemies call him the Wisest Man.	28	34
take	STATIVE	What he proposed to do would take but a few minutes.	29	32
recalled	DYNAMIC	He recalled that a Sunday Special had once calculated that the working time of Arnold Thorndike brought him in two hundred dollars a minute.	3	10
cost	STATIVE	At that rate, keeping Spear out of prison would cost a thousand dollars.	48	51
appear	DYNAMIC	He could not help but appreciate the dramatic qualities of the situation; that the richest man in Wall Street should appear in person to plead for a humble and weaker brother.	117	122
called	DYNAMIC	â€œAndrews!â€ he called.	14	20
be	DYNAMIC	As he understood it, Mr. Andrews was now conducting him to that dignitary, and, in a moment, he would be free to return to his own affairs, which were the affairs of two continents.	102	103
seen	DYNAMIC	There were people waiting in the room; strange people, only like those Mr. Thorndike had seen on ferry-boats.	89	92
recognized	DYNAMIC	He recognized that he must not stultify it by a show of irritation.	3	12
send	STATIVE	Next time he would send a clerk.	19	22
expected	STATIVE	He gave rapid orders on many different matters, asked to have read to him a cablegram he expected from Petersburg, and one from Vienna.	89	96
looks	STATIVE	â€œIt looks like peace.â€	4	8
regarded	DYNAMIC	Young Mr. Andrews with his swivel chair tilted back, his hands clasped behind his head, his cigarette hanging from his lips, regarded the man dispassionately.	125	132
did	STATIVE	So greatly did it differ from the procedure of his own office, that he listened with interest.	11	13
covered	DYNAMIC	The hand of the banker went vaguely to his chin, and from there fell to his pearl pin, which he hastily covered.	104	111
see	STATIVE	Young Andrews swung his swivel chair sothat, over his shoulder, he could see Mr. Thorndike.	73	75
is	DYNAMIC	She deserves it.That son of yours, Mrs. Bernard,â€ he declared emphatically, â€œis no good!â€	76	78
shocked	DYNAMIC	The brutality shocked Mr. Thorndike.	14	20
felt	STATIVE	For the woman he felt a thrill of sympathy,but at once saw that it was superfluous.	17	20
continued	DYNAMIC	She continued merely to smile.	4	12
is	DYNAMIC	â€œThat son of yours,â€ repeated young Andrews, â€œis a leech.	45	47
did	STATIVE	Best thing I ever did for YOU was to send him up the river.â€	18	20
appealed	DYNAMIC	Young Andrews flung up his hands and appealed to Thorndike.	37	44
bet	DYNAMIC	And Iâ€™ll bet sheâ€™s got a cake for him in that basket!â€	9	11
included	STATIVE	Apparently there were many aspects and accidents of life not included in his experience.	61	68
called	DYNAMIC	"â€œThatâ€™s all right, Joe,â€ called young Mr. Andrews, â€œheâ€™s with ME."""	25	30
felt	STATIVE	He felt he had lost his individuality.	3	6
permitted	STATIVE	Because Andrews had a pull he was permitted to sit as an equal among police-court lawyers.	34	42
abandoned	DYNAMIC	Then even Andrews abandoned him.	18	26
appeared	DYNAMIC	The subject of their discourse was one Mike Donlin, as he appeared in vaudeville.	58	65
sat	DYNAMIC	Mr. Thorndike sat down.	14	16
distinguish	DYNAMIC	The court attendant droned loudly words Mr. Thorndike could not distinguish.	64	75
smiling	STATIVE	Mr. Thorndike was still smiling when young Andrews leaned over the rail.	24	30
stood	DYNAMIC	Mr. Thorndike stood up.	14	18
stared	DYNAMIC	Mr. Andrews stared in amazement.	12	17
comes	STATIVE	â€™Youâ€™ve got to wait tillyour man comes up.	33	37
given	DYNAMIC	The clock on the wall showed him that, already, he had given to young Spear onehour and a quarter.	55	59
was	DYNAMIC	In half an hour there was a board meeting; later, he was to hold a post mortem on a railroad; at every moment questions were being asked by telegraph, by cable, questions that involved the credit of individuals, of firms, of even the country.	22	24
assured	DYNAMIC	He assured his honor that he must have more time to prepare his case.	3	9
recognized	DYNAMIC	â€œThose persons,â€ he said, â€œwho cannot respect the dignity of this court will leaveit.â€ As he spoke, with his eyes fixed on those of Mr. Thorndike, the latter saw that the young judge had suddenly recognized him.	196	205
warned	DYNAMIC	â€œShould have warned you.	13	18
did	STATIVE	What did Itell you; mothers are all alike.	5	7
stood	STATIVE	Mr. Thorndike stood irresolute, and then sank back into his chair.	14	18
filled	STATIVE	The probation officer, her hands filled with papers, bustled forward andwhispered.	33	38
supported	DYNAMIC	He has a wife and three children; has supported them for five years.â€	38	46
stood	DYNAMIC	A thin, washed-out, pretty woman stood up, and clasped her hands in front ofher.	33	37
held	DYNAMIC	She held out her hands as though she would physically drag her husband from the pillory.	4	7
found	DYNAMIC	Other men followed, and in the fortune of each Mr. Thorndike found himself, to hissurprise, taking a personal interest.	61	65
seen	DYNAMIC	It reminded him of the Sicilians he had seen in London in their little sordid tragedies.	40	43
left	DYNAMIC	It was an uncomfortable sensation that left him restless because, as he appreciated, it needed expression, an outlet.	39	42
found	DYNAMIC	He found this, partially, in praising, through Andrews, the young judge who had publicly rebuked him.	3	7
found	DYNAMIC	Mr. Thorndike found him astute, sane; his queries intelligent, his comments just.	14	18
whispered	STATIVE	â€œI like her looks,â€ whispered the great man.	20	28
strikes	STATIVE	â€œLike her clear eyes and clean skin.She strikes me as able, full of energy, and yet womanly.	40	46
insisted	DYNAMIC	These men when they come under her charge,â€ he insisted, eagerly, â€œneed money to start again, donâ€™t they?â€ He spoke anxiously.	47	55
found	DYNAMIC	He believed he had found the clew to his restlessness.	19	23
looked	DYNAMIC	Andrews looked at him curiously.	8	13
felt	DYNAMIC	In helping here, he felt a genial glow of personal pleasure.	20	23
caused	DYNAMIC	In the rear of the court-room there was a scuffle that caused every one to turnand look.	55	60
rose	DYNAMIC	Andrews rose anxiously.	8	11
stood	STATIVE	So great was his interest that he had forgotten the particular derelict he had come to serve, until Spear stood almost at his elbow.	106	110
came	STATIVE	â€œWhen you were your own worst enemy, your friends came to help you.	50	53
speak	DYNAMIC	These letters speak for you; your employers, whom you robbed, have pleaded with me in your favor.	14	18
appears	STATIVE	It appears you can not.	3	9
place	DYNAMIC	In view of the good character to which your friends have testified, and on the condition that you do not touch liquor, I will not sentence you to jail, but will place you in charge of the probation officer.â€	161	165
was	DYNAMIC	It was finished.Spear was free, and from different parts of the courtroom people were moving toward the door.	3	5
felt	DYNAMIC	Mr. Thorndike felt a certain twinge of disappointment.	14	17
bringing	DYNAMIC	Even though the result relieved and pleased him, he wished, in bringing it about, he had had some part.	63	70
assisted	DYNAMIC	He had neglected his own interests, and in no way assisted those of Spear.	50	57
called	DYNAMIC	He was moving out of the railed enclosure when Andrews called him by name.	55	60
offer	DYNAMIC	Spear did not offer his hand, but Mr. Thorndike took it, and shook it, and said:â€œI want to meet your mother.â€	14	18
remembered	STATIVE	Spear tried to stop sobbing long enough to tell him how happy shewas, and how grateful, he instead told her what a fine son she had, and that he remembered when Spear used to carry flowers to town for her.	145	154
remembered	STATIVE	And she remembered it, too, and thanked him for the flowers.	8	17
called	DYNAMIC	Andrews,â€ he called, â€œjump in, and Iâ€™ll give you a lunch at Sherryâ€™s.â€	13	19
called	DYNAMIC	â€œWait till I get my hat!â€ he called.	29	35
rolled	DYNAMIC	As the two truants rolled up the avenue the spring sunshine warmed them, the senseof duties neglected added zest to their holiday, and young Mr. Andrews laughed aloud.	19	24
is	DYNAMIC	This work is hereby released into the Public Domain.	10	11
stored	DYNAMIC	He used it to preserve baby tomatoes, cucumbers, and strawberries in translucent cubes that he stored in the pantry for spring-time meals in the middle of winter.	95	100
kept	STATIVE	Mama kept her mink jacket, a family hand-me-down, safe from time in a stopbox, and lent the capturador to my uncle for his stamp collection.	5	8
found	DYNAMIC	We found our baby shoes protected in stopboxes.	3	7
sat	STATIVE	I took mine home, where they sat above my computer while I worked on my first play.	29	31
trapped	DYNAMIC	Bringing my face close to the shoes, I breathed deeply of air that my parents had trapped while closing up that symbol of their love for me.	82	88
gone	DYNAMIC	Last year, I rented a small house on Vega IV, a sea world, all islands and reefs and archipelagos, turquoise waters and aquamarine skies, sunrises like symphonies and sunsets like stars gone supernova.	186	189
indicate	DYNAMIC	The following events may indicate otherwise.	25	32
named	STATIVE	In fine tourist tradition, most homes on Vega IV are named.	53	58
viewed	DYNAMIC	Were they mood-sensitive, they would have changed as I first viewed them.	61	66
reads	DYNAMIC	(Allow memy self-indulgences as you would those of a dying man -- when I convince my mindsmith to permit the wipe, there will be another Bernardo Flynn, one who knows no more of Tasha Cortez or Vega IV than he reads here.)	210	214
showing	DYNAMIC	Her brows drew together, creasing the lovely, caramel-colored skin around her eyes and showing the pattern for an old woman's wrinkles on her forehead.	87	93
caught	DYNAMIC	"She caught herself, slid her jaw infinitesimally back into place, and said, ""You don't like it?"""	4	9
looked	DYNAMIC	I looked at her.	2	7
frowned	DYNAMIC	She frowned.	4	11
smiling	DYNAMIC	Obscenely ugly, said she, smiling too.	26	32
making	DYNAMIC	Cloudwood had been used ina Mediterranean manner, making the house seem primitive and civilized at the same time.	50	55
felt	STATIVE	"From the living room, the view of the beach struck me with such intensity that Tasha asked if I felt ill. All I could say was, ""No."	96	99
referred	DYNAMIC	We both thought I referred to the vista.	18	25
left	DYNAMIC	My heart convulsed, and I left this manuscript for a three-day spree.	26	29
lasted	STATIVE	Apparently I was so successful that it lasted a week and a half.	39	44
wait	STATIVE	This logic does not soothe her; she says I must wait three weeks.	48	51
appears	DYNAMIC	I will not answer the phone for a week, no matter whose face appears on it.	61	67
keep	DYNAMIC	I keep evading the issue.	2	5
deal	STATIVE	To deal with the first: it hurts to remember.	3	6
lay	STATIVE	Tasha's witchery lay in making old acts new.	17	19
filled	DYNAMIC	I want to pick up with Tasha and me walking about The Sleeping Flamingo, andthen, for the sake of literary convenience, to say that from a corner of the yard I saw a neighboring house, and the sight filled me with darkest forebodings.	199	204
occupied	STATIVE	-- occupied The Flamingo.	3	10
plan	STATIVE	I do not plan to write a book: this narrative must move more quickly.	9	12
happens	DYNAMIC	It was the sort of romance that happens so rarely that most people believe it does not happen at all, the sort of romance that sustains the hopeless billions who regularly watch A Wandering Star Called Love.	32	38
left	DYNAMIC	She was a twenty-four-year-old (Terran Standard) N'Apulcanwho left university training in hydroponics to work for her aunt's real estate firm.	62	65
did	DYNAMIC	Her family said she did it to support her father, who was dying of a particularly painful degenerative disease.	20	22
bothered	DYNAMIC	That bothered (yes, and intrigued) me until I realized that she was bored by most plays, movies, and vid.	5	12
did	STATIVE	She did not like being a spectator.	4	6
suffered	STATIVE	I often told her that she should have a bio-check to see if she suffered from some metabolic imbalance.	64	71
reminds	DYNAMIC	The shimmer of light on their surfaces always reminds us that we're looking at an instant snatched from under the hooves of time.	46	52
does	DYNAMIC	The mindwipewill take its creation from my future self -- but time too often does that without aid.	77	80
mention	DYNAMIC	Now I will mention it, in case I/You decide to restore it.	11	17
left	DYNAMIC	"Shortly before she left, Tasha said, ""You steal from life for art, Bernardo."	19	23
had	DYNAMIC	"He's had shows in Brazil and New Madrid and everywhere!He may be more famous than you."""	5	7
remembered	DYNAMIC	I remembered an article in The Medusa and a photo of a work inwhich 100-peso notes fell like confetti onto a small Undersider, sexlessly young in grimy, oversized clothing.	2	11
meet	DYNAMIC	I didn't meet him, jealous old one.	9	12
thought	DYNAMIC	"If I thought he could free me from you -- """	5	11
wrapped	DYNAMIC	She wrapped her arms around my stomach.	4	10
gone	DYNAMIC	Wondering about the reason for her extravagance, I asked how work had gone that day.	70	73
liked	STATIVE	The critics liked it.	12	16
guessed	DYNAMIC	As you may have guessed, we had talked about such things.	16	23
claim	DYNAMIC	I do not claim ourswas a perfect affair, only a wonderful one.	9	13
studied	DYNAMIC	"She studied me as a suspicious puppy might, then said, ""I'm sorry, too."""	4	10
had	DYNAMIC	I had to grin, so I did.	2	4
thinking	DYNAMIC	I've been thinking about the mindwipe, now two days away.	10	17
did	STATIVE	I did not expect you -- 	2	4
held	DYNAMIC	"He held it out, andwith a delighted ""Oh!"""	3	6
thought	DYNAMIC	I stopped writing, and only the thought that I might miss the mindwipe kept mefrom another spree.	32	38
left	DYNAMIC	But Undersiders left me alone.	16	19
