verb	label	sentence	start_char	end_char
originating	STATIVE	American football evolved in the United States, originating from the sport of rugby football.	48	58
specified	DYNAMIC	"A set of rule changes drawn up from 1880 onward by Walter Camp, the ""Father of American Football,"" established the snap, eleven-player teams and the concept of downs, and later rule changes legalized the forward pass, created the neutral zone, and specified the size and shape of the football."	248	256
referred	STATIVE	"In the United States, American football is referred to as ""football."""	43	50
called	STATIVE	"The term ""football"" was officially established in the rulebook for the 1876 college football season, when the sport first shifted from soccer-style rules to rugby-style rules; although it could easily have been called ""rugby"" at this point, Harvard, one of the primary proponents of the rugby-style game, compromised and did not request the name of the sport be changed to ""rugby""."	211	216
continued	STATIVE	Collegiate play continued for several years in which matches were played using the rules of the host school.	16	24
specified	DYNAMIC	Teams were set at 20 players each, and fields of 400 by 250 feet were specified.	70	79
allowed	STATIVE	Harvard abstained from the conference, as they favored a rugby-style game that allowed running with the ball.	79	85
regarded	STATIVE	"Yale player Walter Camp, now regarded as the ""Father of American Football,"" passed rule changes in 1880 that reduced the team size from 15 to 11 players and instituted the snap to replace the chaotic and inconsistent scrum."	29	36
hold	DYNAMIC	A group of Princeton players realized that, as the snap was uncontested, they now could hold the ball indefinitely to prevent their opponent from scoring.	88	91
held	DYNAMIC	Each team held the ball, gaining no ground, for an entire half.	10	13
named	DYNAMIC	Sixty-two schools met in New York City to discuss rule changes on December 28, 1905, and these proceedings resulted in the formation of the Intercollegiate Athletic Association of the United States, later named the National Collegiate Athletic Association (NCAA).	205	209
allowed	DYNAMIC	The roughing-the-passer penalty was implemented in 1914, and eligible players were first allowed to catch the ball anywhere on the field in 1918.	89	95
regarded	STATIVE	"jpg|thumb|right|200px|William ""Pudge"" Heffelfinger, widely regarded as the first professional football player"	59	66
frowned	STATIVE	Despite these extra benefits, the game had a strict sense of amateurism at the time, and direct payment to players was frowned upon, if not outright illegal.	119	125
aimed	DYNAMIC	The National Football League (NFL), a group of professional teams that was originally established in 1920 as the American Professional Football Association, aimed to solve these problems.	157	161
referred	DYNAMIC	"Football in general became increasingly popular following the 1958 NFL Championship game, a match between the Baltimore Colts and the New York Giants that is still referred to as the ""Greatest Game Ever Played""."	164	171
survived	STATIVE	The AFL began in relative obscurity but survived for several years due to a television contract with the ABC network.	40	47
maintained	STATIVE	College football maintained a tradition of postseason bowl games.	17	26
featured	STATIVE	"Teams may substitute any number of their players between downs; this ""platoon"" system replaced the original system, which featured limited substitution rules, and has resulted in teams utilizing specialized offensive, defensive and special teams squads."	122	129
advised	STATIVE	"NCAA and NFHS teams are ""strongly advised"" to number their offensive players according to a league-suggested numbering scheme."	34	41
considered	STATIVE	An offensive formation is considered illegal if there are more than four players in the backfield or fewer than five players numbered 50-79 on the offensive line.	26	35
allowed	STATIVE	Neither team's players, with the exception of the snapper, are allowed to line up in or cross the neutral zone until the ball is snapped.	63	69
runs	DYNAMIC	The quarterback lines up behind the center to take the snap and then hands the ball off, throws it or runs with it.	102	105
called	STATIVE	Archimedes' screw, also called the Archimedean screw or screwpump, is a machine historically used for transferring water from a low-lying body of water into irrigation ditches.	24	29
attributed	DYNAMIC	The screw pump is commonly attributed to Archimedes on the occasion of his visit to Egypt.	27	36
reflect	DYNAMIC	This tradition may reflect only that the apparatus was unknown to the Greeks before Hellenistic times and was introduced in Archimedes' lifetime by unknown Greek engineers.	19	25
attached	STATIVE	In some designs, the screw is attached to the casing and they both rotate together, instead of the screw turning within a stationary casing.	30	37
attached	STATIVE	Depictions of Greek and Roman water screws show them being powered by a human treading on the outer casing to turn the entire apparatus as one piece, which would require that the casing be rigidly attached to the screw.	197	204
designed	STATIVE	The principle is also found in pescalators, which are Archimedes' screws designed to lift fish safely from ponds and transport them to another location.	73	80
credited	STATIVE	The invention of the water screw is credited to the Greek polymath Archimedes of Syracuse in the 3rd century BC.	36	43
found	STATIVE	A variant of the Archimedes' screw can also be found in some injection molding machines, die casting machines and extrusion of plastics, which employ a screw of decreasing pitch to compress and melt the material.	47	51
operating	DYNAMIC	Settle Hydro and Torrs Hydro are two reverse screw micro hydro schemes operating in England.	71	79
keep	DYNAMIC	There are several subgroups, for example Totobiegosode were isolated, but many of them have been eventually relocated forcibly, while some remnants still keep avoiding contact.	154	157
threatened	STATIVE	The Ayoreo are threatened by deforestation.	15	24
continue	STATIVE	Though the Scottish Great Highland bagpipe have the greatest visibility in the English-speaking world, bagpipes have been played for centuries (and continue to be played) throughout large parts of Europe, Turkey, the Caucasus, around the Persian Gulf and in Northern Africa.	148	155
held	STATIVE	Most bagpipes have more than one drone (and, sometimes, more than one chanter) in various combinations, held in place in stocks â€” sockets that fasten the various pipes to the bag.	104	107
cover	DYNAMIC	In some pipes the player must cover the tip of the blowpipe with his tongue while inhaling, but most blowpipes have a non-return valve that eliminates this need.	30	34
keeps	DYNAMIC	The player keeps the bag inflated by blowing air into it through a blowpipe or pumping air into it with a bellows.	11	15
share	STATIVE	Thus most bagpipes share a constant, legato sound where there are no rests in the music.	19	23
installed	STATIVE	The note from the chanter is produced by a reed installed at its top.	48	56
allowing	STATIVE	Some drones have a tuning screw, which effectively alters the length of the drone by opening a hole, allowing the drone to be tuned to two or more distinct pitches.	101	108
pitched	STATIVE	In most types of pipes, where there is one drone it is pitched two octaves below the tonic of the chanter.	55	61
estimated	STATIVE	It is estimated to have 2,400 members in 210 chapters, located in 22 countries.	6	14
named	DYNAMIC	"The Federal Bureau of Investigation and the Criminal Intelligence Service Canada have named the Bandidos an ""outlaw motorcycle gang""."	86	90
found	STATIVE	The Bandidos are also found in Australia; aside from the non-locale-specific Nomads chapter, the chapters are located in Adelaide, Ballarat, Brisbane (Bayside, Centro, City), Byron Bay, Cairns, Geelong, Gold Coast, Hunter Region, Port Stephens, Ipswich, Melbourne, Mid North Coast, Mid State, Mission Beach, Noosa, North Victoria, Northside, Sunshine Coast, Sydney, and Toowoomba, and were acquired with much bloodletting.	22	26
aligned	DYNAMIC	In 2013 it was reported that some former Highway 61 members in Christchurch had aligned with the Bandidos.	80	86
wear	DYNAMIC	These groups usually wear reverse colors (gold border with red background rather than the Bandidos' red-borderâ€“andâ€“gold background).	21	24
wear	DYNAMIC	"They also commonly wear a unique patch (known as the ""Heart Patch"") consisting of a round patch in Bandidos colors on the front upper left of the colors (vest), as worn by the member."	19	22
regret	STATIVE	"I don't regret it.	I don't regret it."	8	13
stating	DYNAMIC	In regards to the murder of Robert Quiroga, the Bandidos Motorcycle Club denounced any involvement in the crime, stating that Merla's actions were his own, and not those of the Club.	113	119
named	STATIVE	In March 2006 police in Austin, Texas announced that the Bandidos were the prime suspects in the March 18, 2006 slaying of a 44-year-old local motorcyclist named Anthony Benesh.	156	160
marking	STATIVE	"The murder occurred on the same weekend as the annual Bandidos MC ""Birthday Party"" in Southeast Texas, marking the 40th anniversary of the club's 1966 founding."	103	109
known	DYNAMIC	"A turf and drug war between the Hells Angels and the Bandidos, known as the ""Great Nordic Biker War"" raged from 1993 until 1997."	63	67
bombed	DYNAMIC	He bombed two cars in Gothenburg, in September 2006, with hand grenades, in acts of revenge as the victims had previously testified against him.	3	8
loaded	STATIVE	Police found a .45 calibre semi-automatic pistol which was loaded with seven bullets.	59	64
organized	DYNAMIC	"Hells Angels Quebec president Maurice Boucher organized ""puppet clubs"" to persuade local Montreal, Quebec club Rock Machine-controlled bars, and their resident drug dealers, to surrender their illegal drug business."	46	54
held	DYNAMIC	"The victims were brought to the farm of Kellestine, where they were held captive before being systematically led out of his barn and murdered ""execution style."""	68	71
spread	DYNAMIC	Many of the remaining Canadian Bandidos would later go on to re-form the Rock Machine Biker Gang in Canada early in 2008 which would spread outside their traditional home of Quebec and open up chapters in Australia and the United States.	133	138
forming	DYNAMIC	"In February 2010, about 8 ethnic Turkish Bandido members and supporters in Berlin in an unprecedented move defected and joined the Hells Angels, forming a sub-chapter known as ""Hells Angels Nomads TÃ¼rkiye""."	145	151
forbidden	DYNAMIC	The display of Bandidos Symbols and the wearing of Bandidos Regalia was also forbidden in North Rhine-Westphalia.	77	85
runs	STATIVE	"The name ""Bari of the Nile Valley"" would be fitting because the river Nile runs through the heart of the Bari land."	75	78
distinguish	STATIVE	This definition would also distinguish them from any other ethnic groups that may be using the name Bari; there are apparently such groups in Ethiopia and Somalia, although no information exist as to whether they are all anthropologically related, as well as in India and Pakistan.	27	37
devastated	DYNAMIC	The Bari are consistently under pressure: now from modern urbanization annexing their green lands and infusing different cultures into their lifestyles; and historically the Baris have been devastated by slave traders, and forced by Belgians (especially from the Lado enclave) into labor camps and used as porters to carry ivory tusks to the Atlantic coast.	190	199
made	STATIVE	Today the Bari's demography is made up of Christians (Catholics and Protestants), Muslims, and followers of traditional religions (not organized).	31	34
mounted	DYNAMIC	Accordingly, the Bari mounted a counterattack that was devastating to both sides.	22	28
were	DYNAMIC	Girls were raped, or taken as wives by force.	6	9
kept	DYNAMIC	Some of the merchants even built fortified depots near Gondokoro where people were kept awaiting shipment down the White Nile.	83	86
indicate	STATIVE	Diaries of European missionaries in the region, indicate that in the market of Cairo (Egypt), the number of slaves to be sold to Europe from the White Nile area increased from 6,000 between 1858 and 1862, to approximately 12,000-15,000 per annum.	48	55
reflected	STATIVE	These numbers reflected mostly, Bari, Dinka, and Mundari; but also included people of other ethnic groups neighboring the Bari, and beyond were hunting for elephant tusks was intense during that time.	14	22
devastated	STATIVE	When authorities finally turned around and put pressure on the slave traders, the Bari people and land were already devastated.	116	126
spread	STATIVE	Bari Folklore tells us of how long ago the land flanking the Nile was full of strings of villages spread out to the horizon, as far as the eye could see.	98	103
considering	STATIVE	Ever since then, recovery has been difficult, considering also the fact that the civil wars in 1955-1973; and 1983-2005 have further taken their toll on the Bari.	46	56
presents	DYNAMIC	After a suitable era of courtship, the suitor usually presents himself at the house of the girl's parents to declare engagement (Nyera in Bari).	54	61
accompanied	DYNAMIC	He is usually accompanied by a few close relatives and friends.	14	24
preceded	STATIVE	Following that (months later) comes the wedding day (Budu in Bari) preceded by two to three days of negotiation for the amount of dowry the bridegroom is obligated to offer.	67	74
representing	DYNAMIC	This occasion takes place in the house of the bride's parents, and involves relatives or friends representing parents of the bride and bridegroom.	97	108
complicated	DYNAMIC	The conversion of Bari into Christianity, and the religious obligation for Church matrimony complicated this last step for Bari couples or any bridegroom marrying a Bari bride.	92	102
saving	DYNAMIC	Therefore, most couples, put off holding the Christian matrimony/wedding for a year or sometimes years while saving money for the occasion.	109	114
born	DYNAMIC	In the meantime a child or two may even be born during this waiting period.	43	46
defines	DYNAMIC	The Merriam-Webster dictionary defines dowry (based on European cultures) as: 1) the money, goods, or estate that a woman brings to her husband in marriage; 2) a gift of money or property by a man to or for his bride.	31	37
accounted	DYNAMIC	Currently, the net dowry in a Bari marriage is not reached arbitrarily, but rather each component in the composite dowry is accounted for as a form of honorarium.	124	132
made	STATIVE	The components of a typical traditional Bari dowry are made up of live animals, averaging 23 heads of cattle (cows, calves and bulls), 40 goats and sheep.	55	58
accept	DYNAMIC	In the event of drought or other natural disasters, the Bari accept money in-lieu of animals.	61	66
settled	DYNAMIC	The case may be settled during the traditional dowry negotiation or in a modern government civil court.	16	22
records	DYNAMIC	The teams switch between batting and fielding whenever the fielding team records three outs.	73	79
recognized	STATIVE	By the late 19th century, baseball was widely recognized as the national sport of the United States.	46	55
divided	STATIVE	In the United States and Canada, professional Major League Baseball (MLB) teams are divided into the National League (NL) and American League (AL), each with three divisions: East, West, and Central.	84	90
split	STATIVE	The top level of play is similarly split in Japan between the Central League and Pacific Leagues and in Cuba between the West League and East League.	35	39
appear	STATIVE	Other old French games such as thÃ¨que, la balle au bÃ¢ton, and la balle empoisonnÃ©e also appear to be related.	88	93
held	STATIVE	Consensus once held that today's baseball is a North American development from the older game rounders, popular in Great Britain and Ireland.	15	18
suggests	DYNAMIC	Baseball Before We Knew It: A Search for the Roots of the Game (2005), by David Block, suggests that the game originated in England; recently uncovered historical evidence supports this position.	87	94
argues	DYNAMIC	"Block argues that rounders and early baseball were actually regional variants of each other, and that the game's most direct antecedents are the English games of stoolball and ""tut-ball""."	6	11
suggests	DYNAMIC	It has long been believed that cricket also descended from such games, though evidence uncovered in early 2009 suggests that cricket may have been imported to England from Flanders.	111	118
shows	STATIVE	"It contains a rhymed description of ""base-ball"" and a woodcut that shows a field set-up somewhat similar to the modern gameâ€”though in a triangular rather than diamond configuration, and with posts instead of ground-level bases."	67	71
featured	STATIVE	"David Block discovered that the first recorded game of ""Bass-Ball"" took place in 1749 in Surrey, and featured the Prince of Wales as a player."	101	108
appears	DYNAMIC	The first known American reference to baseball appears in a 1791 Pittsfield, Massachusetts, town bylaw prohibiting the playing of the game near the town's new meeting house.	47	53
referred	DYNAMIC	"These games were often referred to locally as ""town ball"", though other names such as ""round-ball"" and ""base-ball"" were also used."	23	30
recognized	STATIVE	"While there are reports that the New York Knickerbockers played games in 1845, the contest now recognized as the first officially recorded baseball game in U.S. history took place on June 19, 1846, in Hoboken, New Jersey: the ""New York Nine"" defeated the Knickerbockers, 23â€“1, in four innings."	95	104
were	DYNAMIC	"By 1856, local journals were referring to baseball as the ""national pastime"" or ""national game""."	24	27
referred	DYNAMIC	"As the oldest surviving major league, the National League is sometimes referred to as the ""senior circuit""."	71	78
representing	DYNAMIC	The pact formalized relations both between the two major leagues and between them and the National Association of Professional Base Ball Leagues, representing most of the country's minor professional leagues.	146	157
held	DYNAMIC	The next year, the series was not held, as the National League champion New York Giants, under manager John McGraw, refused to recognize the major league status of the American League and its champion.	34	38
were	DYNAMIC	During the major leagues' early decades, players on various teams occasionally attempted strikes, which routinely failed when their jobs were sufficiently threatened.	137	140
tended	STATIVE	In general, the strict rules of baseball contracts and the reserve clause, which bound players to their teams even when their contracts had ended, tended to keep the players in check.	147	152
demanded	STATIVE	"The ""inside game"", which demanded that players ""scratch for runs"", was played much more aggressively than it is today: the brilliant and often violent Ty Cobb epitomized this style."	25	32
banning	STATIVE	Strict new regulations governing the ball's size, shape and composition along with a new rule officially banning the spitball, along with other pitches that depended on the ball being treated or roughed-up with foreign substances after the death of Ray Chapman who was hit by a pitch in August 1920, coupled with superior materials available after World War I, resulted in a ball that traveled farther when hit.	105	111
had	DYNAMIC	The construction of additional seating to accommodate the rising popularity of the game often had the effect of bringing the outfield fences closer in, making home runs more common.	94	96
invested	DYNAMIC	"In the late 1920s and early 1930s, St. Louis Cardinals general manager Branch Rickey invested in several minor league clubs and developed the first modern ""farm system""."	85	92
held	DYNAMIC	The inaugural College World Series was held in 1947, and the Babe Ruth League youth program was founded.	39	42
mounted	STATIVE	The objective is to shoot a ball through a hoop in diameter and high mounted to a backboard at each end.	69	75
called	STATIVE	"Violations are called ""fouls""."	15	20
nailed	DYNAMIC	After rejecting other ideas as either too rough or poorly suited to walled-in gymnasiums, he wrote the basic rules and nailed a peach basket onto a 10-foot (3.05 m) elevated track.	119	124
gain	DYNAMIC	Whenever a person got the ball in the basket, his team would gain a point.	61	64
nailed	STATIVE	The baskets were originally nailed to the mezzanine balcony of the playing court, but this proved impractical when spectators on the balcony began to interfere with shots.	28	33
called	DYNAMIC	"Naismith called the new game ""Basket Ball""."	9	14
spread	DYNAMIC	Basketball's early adherents were dispatched to YMCAs throughout the United States, and it quickly spread through the USA and Canada.	99	104
established	STATIVE	By 1895, it was well established at several women's high schools.	21	31
discouraged	DYNAMIC	While the YMCA was responsible for initially developing and spreading the game, within a decade it discouraged the new sport, as rough play and rowdy crowds began to detract from the YMCA's primary mission.	99	109
including	DYNAMIC	In 1901, colleges, including the University of Chicago, Columbia University, Dartmouth College, the University of Minnesota, the U.S.	19	27
form	DYNAMIC	In 1905, frequent injuries on the football field prompted President Theodore Roosevelt to suggest that colleges form a governing body, resulting in the creation of the Intercollegiate Athletic Association of the United States (IAAUS).	112	115
spurred	STATIVE	Partially spurred by an association with cheating, the NIT lost support to the NCAA tournament.	10	16
carry	STATIVE	Basketball's popularity remains high, both in rural areas where they carry the identification of the entire community, as well as at some larger schools known for their basketball teams where many players go on to participate at higher levels of competition after graduation.	69	73
represented	DYNAMIC	In the 2003â€“04 season, 1,002,797 boys and girls represented their schools in interscholastic basketball competition, according to the National Federation of State High School Associations.	48	58
held	DYNAMIC	The National Interscholastic Basketball Tournament for Black High Schools was held from 1929 to 1942 at Hampton Institute.	78	81
held	DYNAMIC	The National Invitational Interscholastic Basketball Tournament was held from 1941 to 1967 starting out at Tuskegee Institute.	68	71
held	DYNAMIC	The last tournaments were held at Alabama State College from 1964 to 1967.	26	29
threatened	DYNAMIC	An upstart organization, the American Basketball Association, emerged in 1967 and briefly threatened the NBA's dominance until the ABA-NBA merger in 1976.	90	99
called	STATIVE	* Get 21 points on the player's first two cards (called a blackjack), without a dealer blackjack;	48	54
count	DYNAMIC	A player and the dealer can count his or her own ace as 1 point or 11 points.	28	32
shown	STATIVE	All other cards are counted as the numeric value shown on the card.	49	53
called	STATIVE	"If a player holds an ace valued as 11, the hand is called ""soft"", meaning that the player cannot go bust by taking an additional card; 11 plus the value of any other card will always be less than or equal to 21."	51	56
called	STATIVE	"If the player and dealer have the same point total, this is called a ""push"", and the player typically does not win or lose money on that hand."	60	65
found	STATIVE	The first written reference is found in a book by the Spanish author Miguel de Cervantes, most famous for writing Don Quixote.	31	35
found	STATIVE	Later references to this game are found in France and Spain.	34	38
called	STATIVE	"This hand was called a ""blackjack"" and the name stuck to the game, even though the ten-to-one bonus was soon withdrawn."	14	19
refers	STATIVE	In the modern game, a blackjack refers to any hand of an ace plus a ten or face card, regardless of suits or colours.	32	37
faces	DYNAMIC	At a casino blackjack table, the dealer faces five to seven playing positions from behind a semicircular table.	40	44
shuffled	DYNAMIC	Between one and eight standard 52-card decks are shuffled together.	49	56
referred	DYNAMIC	"The dealer deals cards from his/her left (the position on the dealer's far left is often referred to as ""first base"") to her far right (""third base"")."	89	96
playing	STATIVE	Each box is dealt an initial hand of two cards visible to the people playing on it, and often to any other players.	69	75
made	STATIVE	"The Bloods are made up of various sub-groups known as ""sets"" between which significant differences exist such as colors, clothing, and operations, and political ideas which may be in open conflict with each other."	15	18
documented	DYNAMIC	Bloods have been documented in the U.S. military, found in both U.S. and overseas bases.	17	26
considered	STATIVE	The Pirus are therefore considered to be the original founders of the Bloods.	24	33
establishing	DYNAMIC	By 1996, thousands of members of the Blood street gang were establishing themselves as a formidable force among gangs and continued a steady drive for recruitment.	60	71
refers	STATIVE	"Bloods refers to a loosely structured association of smaller street gangs, known as ""sets,"" which has adopted a common gang culture."	7	12
runs	DYNAMIC	A leader, typically an older member with a more extensive criminal background, runs each set.	79	82
called	STATIVE	"The majority of set members are called ""soldiers,"" who are typically between the ages of 16 and 22."	32	37
identify	STATIVE	Associates are not full members, but they identify with the gang and take part in various criminal activities.	42	49
influenced	DYNAMIC	Recruitment is often influenced by a recruitee's environment.	21	30
offers	STATIVE	Gang membership offers youth a sense of belonging and protection.	16	21
