verb	label	sentence	start_char	end_char
modified	DYNAMIC	Essentially, he proposes that the parent of all Indo-European languages was itself born in central Anatolia, whence it spread eastward, westward, and northward, being modified by the influences of the languages with which it came into contact, till it ultimately emerged in its recognizable, modern manifestations which we categorize into Germanic, Hellenic, Italic, Indo-Iranian, Anatolian, Armenian, Celtic, Tocharian, Albanian, and BaltoSlavic.	167	174
separated	DYNAMIC	Using the evidence available, Renfrew contends that the original Indo-European language, closely related to Hittite, separated after 6500 BC, with the IE languages of western Europe developing from western Anatolia and those of Iran, India, and Pakistan from the eastern division.	117	125
dealing	DYNAMIC	Unfortunately, the presentation of his linguistic argument, where the author is clearly treading on more speculative ground than in those parts dealing with outright archaeology, where he is on more familiar territory, is disorganized and repetitious.	144	150
provides	STATIVE	Nevertheless, good books on archaeology assimilable by laymen are not easy to find, and if the reader can tolerate its shortcomings and is not overly concerned about the precise birthplace of Indo-European, Archaelogy & Language provides an interesting march through the millennia of prehistory in seven-league boots.	229	236
called	DYNAMIC	I called up the synonyms for the adj and the following appeared:	2	7
missing	DYNAMIC	However, when I highlighted antecedent , what appeared on the screen was the same list of synonyms but with antecedent missing, and preceding had reappeared.	119	126
works	DYNAMIC	It works with a hard disk or with a set of floppies and can be used with 29 popular word-processing programs.	3	7
listed	STATIVE	(That was the number listed when I received my copy; it might have increased.)	21	26
called	DYNAMIC	It has a useful â€œHelpâ€ feature that can be called upon at any stage.	43	48
documented	DYNAMIC	The article is a classic, probably the first on the subject to appear in a scholarly journal, though there are other informal references to family language, some of which are documented by Dickson in his Bibliography.	175	184
alternating	DYNAMIC	The soldier in charge would command, after each firing, that the rank on the scaffold step down and be replaced by the rank that had just reloaded, thus alternating ranks and sustaining the rifle fire.	153	163
bear	STATIVE	Mr. Davidson's observations on the Scottishness of Chambers 20th Century Dictionary [XV,1] bear out my own formed over sixteen years of using one.	91	94
employed	DYNAMIC	The monkey on board ship was a lad employed to fetch suppliesâ€”powder and so forthâ€”to the guns.	35	42
kept	STATIVE	The word might also have been used for a receptacle near the guns where powder and balls were kept.	94	98
said	STATIVE	They can still be found today in so-called â€œgift shops.â€ Usually, they come in sets of three, one with its hands over its eyes, one over its ears, and one over its mouth: they were said to represent â€œSee no evil, Hear no evil, Speak no evil.â€ There were various whimsical variants.	181	184
representing	STATIVE	The main problems are representing consonant clusters and word-final consonants.	22	33
come	STATIVE	My absolute favorite of these semantic mistakes, however, does not come from the problem of sound.	67	70
expresses	STATIVE	Japanese has a verb inflection which expresses causation or permissionâ€”in English, â€œto make someone or to let someone do something.â€ One day during a university English class, a very discomfited student, after frantic and obtrusive dictionary work, handed a colleague of mine a scrap of paper.	37	45
written	STATIVE	On it was written this sentence: â€œPlease make me go to the bathroom.â€	10	16
strikes	DYNAMIC	Times , may agree with me in the contention that when he writes about language he seems to be writing on his day off: I cannot put my finger on why, but â€œOn Languageâ€ always strikes me as an excruciating effort to be cute.	174	180
keep	STATIVE	In part, that is attributable to the designation of his correspondents, who keep him informed on language that is not within earshot, as the â€œLexicographic Irregulars,â€ an amusing reference the first time or two it was used but now beginning to cloy.	76	79
prove	STATIVE	More often than it might prove of interest to me, personally, Safire deals with insiders' language in Washington (where he is based) or with trivialities uttered by some politico.	25	29
accept	DYNAMIC	We are descriptive of the usages we accept and prescriptiveâ€”perhaps proscriptive would be more descriptiveâ€”of those we do not like.	36	41
expresses	DYNAMIC	At least Safire expresses an opinion; whether the reader agrees with him is another matter, as are the questions of his accuracy, which arise fairly often, and that of the suitability of his style, which, as far as I know, has not been broached before.	16	24
find	STATIVE	It ill behooves me, excoriated recently as enamored of the â€œcheap larf,â€ to criticize Safire's arch puns, which permeateâ€”â€œenlivenâ€ is probably the word his editor would useâ€”his articles, but I find some kinds of humor unsuitable for reading, however they might evoke a chuckle when uttered viva voce .	193	196
makes	STATIVE	Writing containing such labored figures makes for hard reading.	40	44
find	STATIVE	I am interested in what Safire has to say about language but find myself stymied: I get the feeling that he has deliberately created a minefield of interruptions in thought through which I must pick my way to the end.	61	64
Look	DYNAMIC	You Could Look It Up is the umpteenth collection of Safire's columns and, like the previous collections, contains a selection of letters from readers.	10	13
missed	STATIVE	It is those that are so sorely missed in his column.	31	36
documents	DYNAMIC	For one thing, he documents many neologisms, an activity that endears him to many working lexicographers.	18	26
say	STATIVE	...Einstein's Special Theory of Relativity does not say that E = MCÂ² and in leap year MCÂ³.	52	54
does	STATIVE	Indeed it does not.	10	13
say	STATIVE	But it does say E = mcÂ² ; the version with the capital M and C is, essentially, meaningless to those familiar with the conventional symbolism used in physics.	12	14
called	STATIVE	True, one can find different from , etc., in an entry so headed, but for absolute constructions one is referred to an entry called â€œCovered with onions, relish, and ketchup, I ate a hotdog at the ball-park.â€ If the user wants to find out about misplaced adjectives and adverbs , reference is made to the entry â€œElectric shaver for women with delicate floral design on the handle.â€ A search for only would be futile.	124	129
put	STATIVE	Perhaps the subject and treatment of usage need some lightening up, but I am hard put to agree that they are quite as frivolous and light-headed as this book would have us believe.	82	84
born	STATIVE	A sense of humor about a subject is born of a feeling of security about it, but security is the one characteristic often lacking among those who would use Current American Usage .	36	39
provide	DYNAMIC	All of which is to say that the book is an interesting work on the language and contains accurate, though longwinded information about what it covers, â€œinteresting and useful facts about American English.â€ Its only real faults are its title, which belies the content, the cutesy headings, and the lack of a truly detailed index: self-indexing does not provide coverage of sufficient detail.	352	358
expresses	STATIVE	Penny Perrick regrets (January 11) that â€œThere is no word in English to describe that particular, special sort of pride that one feels in the achievements of one's children.â€ But the verb kvell , which exactly expresses that emotion, is already (like other Yiddish loanwords, such as chutzpah, meshugga and nosh ) to be found in the Supplement to the Oxford-English Dictionary .	210	218
referring	DYNAMIC	The rationale behind referring to them as â€œlostâ€ arises from the author's observation of an unfortunate state of affairs: because of an increasingly widespread lack of familiarity with the basic, structural elements of our cultureâ€”Greek and Roman mythology, the Bible, literature, and ordinary historical factâ€”people today are unable to discern the origins of terms like aphrodisiac, Achilles [sic] heel or tendon, meet one's Waterloo, sow dragon's teeth , and hand-writing on the wall , to name a few.	21	29
covered	STATIVE	Between these is an occasional flash of useful wisdom, much of it pretty well covered by other books of this type (which seem to be proliferating).	78	84
borrowed	DYNAMIC	As for stalemate , which is related to checkmate , would it not have been important to indicate that the - mate part has nothing to do with English, having been borrowed from checkmate which is a loanword from Persian (and has nothing to do with check , either).	161	168
got	STATIVE	When you straddle a horse, you've got one leg on either side of the animal.	34	36
straddles	DYNAMIC	When a politican straddles an issue, he's in much the same position.	17	25
marked	STATIVE	Not all entries contain misleading, dull, or incorrect information, but those that do not are marked by a lack of originality.	94	99
prepared	DYNAMIC	Most prominent among its earliest practitioners in England was Joseph Wright, who prepared the six-volume English Dialect Dictionary , which was published between 1898 and 1905; the best-known contemporary British specialist is Harold Orton.	82	89
investigated	STATIVE	In America, work proceeded space during the 1930s, largely under the direction of Raven McDavid, Hans Kurath, and, later, Harold Allen; more recently, Lee Pedersen and others have investigated American English dialects.	180	191
extracted	STATIVE	The present book is extracted from the two major works that resulted from the Survey, The Linguistic Atlas of England (1978) and A Word Geography of England (1974), both under the direction of Harold Orton, aided by Sanderson and Widdowson in the latter effort.	20	28
selected	DYNAMIC	The 100 maps selected for representation from the Survey yield information on several hundred words, some of which are clear variants, others quite different lexical entities.	13	20
shows	STATIVE	Map 33 shows the distribution of child (most of southern England) and of bairn (north of a slightly wavy line between Boston, on the Wash to the east, and Lancaster, on the west coast).	7	11
set	STATIVE	The maps are clear, each occupying a full page, and the word information is well set forth on them.	81	83
drawn	STATIVE	These are drawn to run midway between/ localities which were shown by the Survey of English Dialects to use the different words or pronunciations which are the subject of the map.	10	14
emphasized	DYNAMIC	The importance of dialect is emphasized regularly in the press, where we read about people being killed, as in parts of India, because they use the wrong shibboleths.	29	38
styled	STATIVE	It is not at once apparent why the book is styled an â€œalmanac,â€ but that is unimportant: there is no other book I know of that contains as much diverse information about American writers as this one.	43	48
make	STATIVE	Its readability and organization make it suitable for browsingâ€”even for reading straight throughâ€”so in that respect, at least, it does not resemble books in the â€œOxford Companionâ€ series.	33	36
related	DYNAMIC	A handful might have led colorful existences, some are objects of interest because they died early, committed suicide, were related to (other) famous people, and so forth; but such information seldom reveals as much about their output as do the creations themselves, and in certain cases one is probably better off not knowing quite so much.	124	130
appears	STATIVE	This book appears to have been diligently researched and has much to recommend it as an adjunct to most libraries, public and private, large and small, general and specialized.	10	16
like	DYNAMIC	I would like to make a couple of comments on articles in the Autumn 1988 issue [XV,2].	8	11
dates	STATIVE	Incidentally, I seem to recall reading somewhere that skins as slang for `dollars' dates from frontier days when trappers used animal skins as currency, and is therefore much older than early 20th-century Harlem.	83	87
keep	STATIVE	-- Donna Because teaching a man to fish will keep him fed for his entire life.	45	48
face	STATIVE	-- Cornell Each year, we help thousands of people who face tremendous obstacles.	54	57
face	STATIVE	A robust economy helps by providing job opportunities, but to be honest, most of the people who aren't working today are quite simply the ones who face the greatest obstacles.	147	150
provide	DYNAMIC	The kinds of services we provide help people deal with obstacles like health care, transportation and child care -problems that are big enough on their own without being compounded by factors like physical and mental disabilities, illiteracy and lack of job skills.	25	31
working	STATIVE	If I wasn't working here...I would be sad... Goodwill helps people get off of public assistance.	12	18
rise	DYNAMIC	Sherry learned through our Future Works class that she could rise out of the mire of the welfare system and support her family.	61	64
combined	DYNAMIC	He trained in desktop publishing and combined his enthusiastic work ethic with new-found skills in a burgeoning industry.	37	44
provides	DYNAMIC	Goodwill provides jobs at Goodwill.	9	16
call	STATIVE	His job objectives call for him to do it in 30.	19	22
called	DYNAMIC	"In their December, 1995 review of the nation's best charities, U.S. News & World Report called Goodwill one of the five ""Standout Good Guys."""	88	93
affect	DYNAMIC	While I appreciate U.S. News & World Report's endorsement, the true value of your support is measured by the way Goodwill takes on problems that affect all of us.	145	150
act	STATIVE	Parents act as role models of self-sufficiency instead of dependency.	8	10
confirms	DYNAMIC	once his tears have subsided, he confirms what his classmates have already figured out: he just received a job offer -- his first in five years.	33	40
takes	STATIVE	It takes a long time for him to gain the self-confidence to work elsewhere in the community.	3	7
leaves	DYNAMIC	He proudly leaves Goodwill to support himself.	11	16
like	DYNAMIC	Just like the respect we've earned from U.S. News & World Report.	5	8
do	STATIVE	Neither do the rest of us who feel the positive results of their success.	8	9
has	DYNAMIC	Everyone has.	9	12
keep	STATIVE	There are a lot of barriers that keep people from working: physical and mental disabilities, history of welfare dependency and lack of education or self-esteem.	33	36
continue	DYNAMIC	So our work must continue.	17	25
benefits	DYNAMIC	Everyone benefits from the work we do together.	9	16
felt	STATIVE	Michael Sims felt that way at age 39 -- the day he earned a job.	13	16
born	DYNAMIC	Michael was born with cerebral palsy.	12	15
lasted	STATIVE	His most recent job lasted only a year before cut-backs eliminated his position.	20	25
called	DYNAMIC	Finally, Michael called Goodwill.	17	22
provides	DYNAMIC	As the Clubhouse Monitor at Bent Tree Apartments, he now provides customer service for 50 to 60 tenants each night.	57	64
set	STATIVE	Now his goals are set on moving up in the company.	18	20
share	STATIVE	Like Michael, they share two common characteristics.	19	23
face	STATIVE	They face some barrier to employment and they want to work.	5	8
comes	STATIVE	With support from people like you, they can overcome their barriers and earn success and the self-sufficiency that comes with it.	115	119
counted	STATIVE	The savings are counted in more ways than dollars and cents, however.	16	22
focused	STATIVE	The families of the new wage earners may feel the accomplishment in terms of a house to live in, money to purchase food -- without food stamps -- and the beginning of a family focused on success, not hopelessness.	176	182
provides	DYNAMIC	Their complaint: the system discourages working because unemployment provides benefits that many entry-level jobs don't include.	69	76
are	DYNAMIC	While the debate on welfare reform is gathering like a storm at sea, the people who need jobs are floundering.	94	96
take	STATIVE	March 17, 2000 Name Address City, ST, Zip Dear Name: When Jerry was released from prison, he knew it would take hard work and determination to straighten out his life.	107	110
was	DYNAMIC	Reality hit when he was unable to reconcile with his wife and ended up on the street.	20	22
referred	DYNAMIC	The Trustee referred him to the Blue Triangle where he consulted Goodwill's Career Academy staff for job search assistance.	12	19
faced	STATIVE	Unemployed, homeless and with a prison record, Jerry now faced going back to prison for failure to pay child support.	57	61
took	STATIVE	It took some time and hard work, but with the help of Goodwill, Jerry was able to work out a payment plan with the prosecutor's office, find housing and conduct a more thorough job search.	3	6
hope	DYNAMIC	But Goodwill offers hope even to people with numerous obstacles to overcome, like Jerry.	20	23
continue	DYNAMIC	For as long as he needs it, Goodwill will continue to help.	42	49
provide	DYNAMIC	Your support of Goodwill will provide job training and placement services to help the hardest to serve in central Indiana find meaningful employment.	30	36
apply	DYNAMIC	Individuals who are being emancipated are eligible to receive up to $500 from the Fund if they formally apply and meet four requirements: 1.	104	108
stating	STATIVE	Possession of a high school diploma or GED Proof of meeting these, two staff reference letters and an essay stating why they should receive a grant and how it will be used are all reviewed by a Pleasant Run panel, which determines if the applicant merits the funds.	108	114
caught	STATIVE	Little ones, like Baby Jessica, caught in the struggle between adoptive and birth parents.	32	37
left	STATIVE	Older kids, like Tracy and Kerry, left homeless after a recent murder-suicide in Indianapolis claimed Mom and Dad.	34	37
like	DYNAMIC	Young adults, like Mary T., a jobless mother of three, trying desperately to keep her kids out of trouble in a crime-ridden neighborhood.	14	17
torn	DYNAMIC	Families are being torn apart, and too often, children are the victims.	19	22
serve	DYNAMIC	Today, we serve children and families with a multitude of problems: emotional, physical, psychological and sexual abuse.	10	14
come	STATIVE	Some come from families where, through therapy, there is hope for reunification.	5	8
served	DYNAMIC	In 1994 Pleasant Run served 346 children and 125 families.	21	26
serve	DYNAMIC	In 1995 we will serve over 850 children and 340 families.	16	20
share	DYNAMIC	But there's no reason why we shouldn't share good news at the same time.	39	43
live	DYNAMIC	Yet few of us hear enough about kids who live through these adversities and do make the grade.	41	44
cares	STATIVE	Pleasant Run cares for at-risk children and families.	13	17
presents	STATIVE	A gift to Pleasant Run means the children in our care will have presents to open.	64	71
have	DYNAMIC	Let our families and children know that you want them to have the same kinds of memories of the holidays you will have.	57	60
making	DYNAMIC	At Pleasant Run, Inc. we are making plans and arrangements for our children and families.	29	34
seek	DYNAMIC	Every year we seek companies, organizations and individuals to sponsor one or more of our families.	14	17
focus	STATIVE	These programs focus on keeping the family together by providing counseling and other services to the entire family.	15	19
committed	STATIVE	I know you're committed to ensuring today's children have safe, healthy, and positive summer experiences.	14	22
face	STATIVE	February 26, 1999 Dear , Kids today face overwhelming pressures, everything from trouble at home to gangs and drugs.	36	39
hold	DYNAMIC	Saturday, September 20,1997, from 2:00 p.m. until 7:00 p.m., marks a special day, as Jameson Camp will hold its first ever Jameson Grill.	103	106
designed	DYNAMIC	The Jameson Grill has been designed to be nothing but fun for you, your family, employees, and maybe even your neighbors.	27	34
referred	DYNAMIC	All children who attend the camp are referred by social workers, doctors, teachers, counselors, and other professionals.	37	44
designed	STATIVE	This event is designed to be fun for campers, their families, friends of the camp, neighbors, staff, and anyone interested in finding out more about Jameson.	14	21
continue	DYNAMIC	Your contribution will help with funding so Jameson Camp can continue providing the year-round camping experience that gives kids a chance to create dreams.	61	68
started	STATIVE	And we're just getting started!	23	30
consider	DYNAMIC	I hope you'll consider continuing your support of Jameson's special campers by renewing your last gift of $ xxx.	14	21
squeezed	STATIVE	All of our Six summer camping sessions are booked to capacity (and, truth be told, with maybe one our two extra returning campers squeezed in) and we have a waiting list of 60 children who are hoping to come if a spot should open.	130	137
limited	STATIVE	It seems summer options aren't readily available for troubled kids whose families have limited incomes, so we're doing all we can to make Jameson available.	87	93
had	DYNAMIC	Two of them told me yesterday that as a group they decided they had to earn the right to ask others for help by accomplishing something real to help themselves.	64	66
see	STATIVE	And that's from kids many people see as a problem.	33	35
designed	STATIVE	Even after the summer sessions come to a close, Jameson campers will take part in year-round programs designed to keep that positive contact with peers and role models alive and important.	102	109
going	STATIVE	We know our follow-up weekends are going to be better attended than ever this fall and winter.	35	39
have	DYNAMIC	If these special children are to become the adults we all need them to be, we have to lead them in the right direction right now.	78	81
continue	DYNAMIC	Jameson points the way for children who need that extra hand and I hope you'll continue your support this year.	79	86
called	STATIVE	The centers that serve these areas, Mary Rigg Neighborhood Center, Hawthorne Community Center, Southwest Multi-Service Center, and Christamore House, have teamed up to run an exciting job readiness program for 14 and 15 year old area residents called the Summer Enrichment Program.	244	249
like	DYNAMIC	We would like to offer our youth a small reward for their participation by presenting them with gift certificates from Target.	9	12
recognize	DYNAMIC	In return, we will recognize Target as a sponsor during our event and in the event program.	19	27
look	STATIVE	We look forward to hearing from you.	3	6
is	DYNAMIC	One of the areas we've decided to focus on is development.	43	44
offer	DYNAMIC	It's clear that if we don't increase our base of private funding, we won't have the kind of control we need to ensure the continued success of our centers and the very important services they offer.	192	197
offer	STATIVE	Just look at the range of services we offer: 70,0001 career assistance for youth Preschool for young children School Age Child Care for and children and youth Access services such as emergency and holiday assistance for all ages Adult Day Care for seniors Senior Case Management Aids Education for youth and adults Senior Social Involvement Computer Training for youth, adults and seniors Senior Nutrition meal program Day Care for young children Social Development and Recreation for children, youth and adults.	38	43
occur	DYNAMIC	Better yet, most of these services occur in cooperation with private and public agencies from all over the city - CICOA The Access Network, Goodwill Industries, Indianapolis Housing Agency, City of Indianapolis, Indianapolis Private Industry Council, Family and Social Services administration, OTC, Indy Parks, and numerous community development corporations, neighborhood organizations, and churches, to name just a few.	35	39
enable	DYNAMIC	Your gift will enable CCI to provide these and other necessary services at a neighborhood level, face-to-face, where it counts.	15	20
enable	DYNAMIC	Enclosed is a donation card that will enable you to make Indianapolis a great place for ALL of us to live.	38	43
serve	DYNAMIC	Its purpose is to encourage collaboration and cooperation between the various agencies, programs, and systems that serve our community's youth.	115	119
consider	DYNAMIC	I am hopeful that you as an individual and Meridian Insurance as a corporation might consider becoming sustaining supporters of MCCOY.	85	92
enclosed	DYNAMIC	I have enclosed a packet of information about MCCOY and its work as well as an application with various options for supporting the youth of our community.	7	14
provides	DYNAMIC	I obviously can't tell the whole story of MCCOY in a single letter but I hope this provides an overview of the scope of our work.	83	90
engaged	DYNAMIC	For the past three years, MCCOY has been actively engaged in accomplishing this declared mission in cooperation with many others: youth service providers, youth, funding bodies, and interested citizens to name a few.	50	56
bear	DYNAMIC	A Providers Council and a Youth Coalition are building relationships that will hopefully bear great fruit in the years to come.	89	92
